{
  "schema_version": "1.0",
  "decision_id": "decision_sim_001",
  "simulation_id": "result_sim_001",
  "portfolio_id": "demo_ethena_01",
  "position_id": "aave_01",
  "scenario_id": "usde_depeg",
  "horizon_days": 7,
  "mode": "conditional_stress",
  "currency": "USD",
  "exit_options": [
    {
      "exit_fraction": "0.00",
      "fees_usd": "0",
      "gas_usd": "0",
      "price_impact_usd": "0",
      "estimated_exit_cost_usd": "0",
      "foregone_yield_usd": "0",
      "residual_stress_loss_usd": "150000.00",
      "break_even_probability": null,
      "objective_usd": null,
      "quote_status": "proxy"
    },
    {
      "exit_fraction": "0.25",
      "fees_usd": "750.00",
      "gas_usd": "40.00",
      "price_impact_usd": "1870.32",
      "estimated_exit_cost_usd": "2660.32",
      "foregone_yield_usd": "244.52",
      "residual_stress_loss_usd": "112500.00",
      "break_even_probability": "0.0775",
      "objective_usd": null,
      "quote_status": "proxy"
    },
    {
      "exit_fraction": "0.50",
      "fees_usd": "1500.00",
      "gas_usd": "40.00",
      "price_impact_usd": "7462.69",
      "estimated_exit_cost_usd": "9002.69",
      "foregone_yield_usd": "489.04",
      "residual_stress_loss_usd": "75000.00",
      "break_even_probability": "0.1266",
      "objective_usd": null,
      "quote_status": "proxy"
    },
    {
      "exit_fraction": "0.75",
      "fees_usd": "2250.00",
      "gas_usd": "40.00",
      "price_impact_usd": "16749.38",
      "estimated_exit_cost_usd": "19039.38",
      "foregone_yield_usd": "733.56",
      "residual_stress_loss_usd": "37500.00",
      "break_even_probability": "0.1758",
      "objective_usd": null,
      "quote_status": "proxy"
    },
    {
      "exit_fraction": "1.00",
      "fees_usd": "3000.00",
      "gas_usd": "40.00",
      "price_impact_usd": "29702.97",
      "estimated_exit_cost_usd": "32742.97",
      "foregone_yield_usd": "978.08",
      "residual_stress_loss_usd": "0",
      "break_even_probability": "0.2248",
      "objective_usd": null,
      "quote_status": "proxy"
    }
  ],
  "recommendation": "INSUFFICIENT_DATA",
  "recommended_exit_fraction": null,
  "reason": "No scenario probability supplied and all quotes are proxies. Reducing by 25% beats staying if the user's probability of this depeg exceeds 7.75%.",
  "warnings": [
    "Exit costs use the constant-product proxy on assumed depth; replace with executable quotes."
  ]
}
